{
  "contract_version": 6,
  "simulation_id": "sim_01K3XQ7M4E8YB2FVN0H9TZQWEU",
  "modality": "chat",
  "connection": {
    "agent_platform": null,
    "connection_type": "scripted",
    "access_variant": "scripted.in_memory",
    "config": {
      "replies": [
        "I can see the duplicate charge on that order — one moment while I reverse it.",
        "The reversal is through. Your confirmation number is RC-4417-DUP.",
        "You are welcome — the confirmation is on its way to your email too. Goodbye."
      ],
      "ends_after_replies": true,
      "turn_seconds": 0,
      "provider_reference": "scripted-chat-hurried-1"
    },
    "credentials": null
  },
  "persona": {
    "name": "Dev",
    "personality": "Dev, 34, messaging from a train platform. In a hurry, fires off short messages, expects quick answers.",
    "parameters": {
      "language": "en-US",
      "emotion": "neutral",
      "accent": "voice_default",
      "speech_volume": 1,
      "execution_policy_version": 1
    }
  },
  "scenario": {
    "instructions": "My card was charged twice for the same order this morning. I need the duplicate charge reversed and a confirmation number before my train arrives. Please be quick about it."
  },
  "limits": {
    "max_duration_seconds": 300,
    "max_turns": 40
  },
  "models": {
    "llm": {
      "provider": "openai",
      "model": "gpt-4o-mini",
      "adapter": "openai_chat_completions",
      "key": "fixture-not-a-real-secret-llm"
    },
    "stt": {
      "provider": "openai",
      "model": "gpt-live-transcribe",
      "adapter": "openai_realtime"
    },
    "tts": {
      "provider": "openai",
      "model": "gpt-4o-mini-tts",
      "adapter": "openai",
      "voice_id": "alloy",
      "speed": 1.15
    }
  }
}
