{
  "contract_version": 6,
  "simulation_id": "sim_01K3XQ7M4E8YB2FVN0H9TZQWET",
  "modality": "chat",
  "connection": {
    "agent_platform": null,
    "connection_type": "scripted",
    "access_variant": "scripted.in_memory",
    "config": {
      "greeting": "Lakeside Dental scheduling, good afternoon. How can I help?",
      "replies": [
        "Of course, we can move that for you. Could I take your full name, please?",
        "Thank you, Margaret. I can see your Tuesday cleaning — that same week I have Thursday at half past two or four o'clock.",
        "All done: your cleaning is moved to Thursday at half past two. Is there anything else?"
      ],
      "turn_seconds": 0,
      "provider_reference": "scripted-chat-flustered-1"
    },
    "credentials": null
  },
  "persona": {
    "name": "Margaret",
    "personality": "Margaret, 68, retired schoolteacher. Polite but easily flustered; asks for things to be repeated and apologises for it.",
    "parameters": {
      "language": "en-US",
      "emotion": "neutral",
      "accent": "voice_default",
      "speech_volume": 1,
      "execution_policy_version": 1
    }
  },
  "scenario": {
    "instructions": "I booked a cleaning for next Tuesday but I need to move it to Thursday that same week. My name is Margaret Hale, sorry to be a bother. The half past two slot would suit me nicely."
  },
  "limits": {
    "max_duration_seconds": 600,
    "max_turns": 60
  },
  "models": {
    "llm": {
      "provider": "openai",
      "model": "gpt-4o-mini",
      "adapter": "openai_chat_completions",
      "key": "fixture-not-a-real-secret-llm"
    },
    "stt": {
      "provider": "deepgram",
      "model": "nova-3-general",
      "adapter": "deepgram"
    },
    "tts": {
      "provider": "cartesia",
      "model": "sonic-3.5",
      "adapter": "cartesia",
      "voice_id": "warm-alto-2",
      "speed": 0.9
    }
  }
}
