{
  "contract_version": 6,
  "simulation_id": "sim_01K5T4P2QW7H3NDXB8ZM6VYJRE",
  "modality": "chat",
  "connection": {
    "agent_platform": "retell",
    "connection_type": "retell_text_mode",
    "access_variant": "retell_text_mode.api_key",
    "config": {
      "retellAgentId": "agent_b0e2e9cb267c47e7e7026cd8e8"
    },
    "credentials": {
      "apiKey": "fixture-not-a-real-secret-0000000000000000"
    }
  },
  "agent_version": 106,
  "dynamic_variables": {
    "account_id": "sim_01K5T4P2QW7H3NDXB8ZM6VYJRE",
    "is_existing": "true",
    "caller_name": ""
  },
  "persona": {
    "name": "Eleanor",
    "personality": "Retired teacher, 68, typing carefully. Polite, thorough, repeats details back to be sure she has them right.",
    "parameters": {
      "language": "en-US",
      "emotion": "neutral",
      "accent": "voice_default",
      "speech_volume": 1,
      "execution_policy_version": 1
    }
  },
  "scenario": {
    "instructions": "Your six-month check-up is on Tuesday and you now have to be somewhere else that morning. You want it moved to any Thursday in the next month, and you want the new date read back to you before the exchange ends."
  },
  "limits": {
    "max_duration_seconds": 600,
    "max_turns": 60
  },
  "models": {
    "llm": {
      "provider": "openai",
      "model": "gpt-4o-mini",
      "adapter": "openai_chat_completions",
      "key": "fixture-not-a-real-secret-llm"
    },
    "stt": {
      "provider": "deepgram",
      "model": "nova-3-general",
      "adapter": "deepgram"
    },
    "tts": {
      "provider": "cartesia",
      "model": "sonic-3.5",
      "adapter": "cartesia",
      "voice_id": "measured-alto-3",
      "speed": 0.95
    }
  },
  "mock_tools": [
    {
      "tool_name": "get_availability",
      "answer": {
        "answer": {
          "slots": [
            "2026-09-03T14:30:00Z"
          ]
        }
      }
    },
    {
      "tool_name": "book_appointment",
      "answer": {
        "error": "the booking service is unavailable"
      }
    }
  ]
}
