{
  "contract_version": 6,
  "simulation_id": "sim_01K4QW7M4E8YB2FVN0H9TZQWES",
  "modality": "voice",
  "connection": {
    "agent_platform": null,
    "connection_type": "phone_number",
    "access_variant": "phone_number.public_e164",
    "config": {
      "phoneNumber": "+15551234567"
    },
    "credentials": null
  },
  "persona": {
    "name": "Dev",
    "personality": "Dev, 34, calling from a train platform. In a hurry, talks over slow answers, background noise comes and goes.",
    "parameters": {
      "language": "en-US",
      "emotion": "neutral",
      "accent": "voice_default",
      "speech_volume": 1,
      "execution_policy_version": 1
    }
  },
  "scenario": {
    "instructions": "Your card was charged twice for the same order this morning. You want the duplicate charge reversed and a confirmation number before you hang up."
  },
  "limits": {
    "max_duration_seconds": 600,
    "max_turns": 40
  },
  "models": {
    "llm": {
      "provider": "openai",
      "model": "gpt-4o-mini",
      "adapter": "openai_chat_completions",
      "key": "fixture-not-a-real-secret-persona-model-0001"
    },
    "stt": {
      "provider": "deepgram",
      "model": "nova-3-general",
      "adapter": "deepgram",
      "key": "fixture-not-a-real-secret-listening-0002"
    },
    "tts": {
      "provider": "cartesia",
      "model": "sonic-3.5",
      "adapter": "cartesia",
      "voice_id": "brisk-tenor-7",
      "speed": 1.15,
      "key": "fixture-not-a-real-secret-speaking-0003"
    }
  },
  "platform": {
    "carrier": {
      "trunk_address": "egma-fixture.pstn.twilio.com",
      "trunk_number": "+15550000000",
      "trunk_username": "egma-fixture-trunk",
      "trunk_password": "fixture-not-a-real-secret-trunk-0004"
    }
  }
}
